{
  "contract_version": 1,
  "idempotency_key": "naruon-idem-001",
  "tenant_workspace_id": "naruon-tenant-workspace-demo",
  "snapshot_id": "tepp-snapshot-demo-001",
  "knowledge_cutoff": "2026-08-01T00:00:00Z",
  "model_contract_version": "topic-measurement-v1",
  "output_profile": "naruon-consumer-validation-report"
}
